{
  "$schema": "../schema/term.schema.json",
  "id": "disguise-window",
  "term": "Disguise Window",
  "aliases": ["Disguise window", "0.0s-1.2s window", "pre-to-post disguise", "disguise window", "mirror window"],
  "category": "Scheme & Concept",
  "shortDef": "The critical first 0.0s to 1.2s interval after the snap where two distinct scheme concepts mimic identical pre-snap pictures and early movement trajectories.",
  "tacticalNote": "Forces opposing defenders and quarterbacks to freeze or misread the play until the ball has already committed to the true tactical path."
}
